Title,Authors,Abstract,Published Year,Published Month,Journal,Volume,Issue,Pages,Accession Number,DOI,Ref,Covidence #,Study,Notes,Tags
The use of TikTok among children and adolescents with Eating Disorders: experience in a third-level public Italian center during the SARS-CoV-2 pandemic,"Pruccoli, Jacopo; De Rosa, Marta; Chiasso, Lucia; Perrone, Annalisa; Parmeggiani, Antonia","Abstract Background Recent research has documented the potential associations existing between the use of social media (SM) and the occurrence/development and treatment of Eating Disorders (ED). However, the literature directly addressing the use of SM TikTok among children and adolescents with ED is still scarce. Methods In January–February 2021, during the second Italian national lockdown due to the SARS-CoV-2 pandemic, an anonymous paper survey was conducted in an Italian third-level center for ED in childhood and adolescence. Demographics, frequency of use of TikTok, frequently viewed topics and hashtags, experienced body-shaming, as well as the use of TikTok (active search, use of proposed contents) and perceived influences of this SM on eating attitudes and self-esteem were assessed. Groups of patients with different perceived SM-induced effects were compared to determine the frequency of their interaction with 3 specific contents (diet, Pro-Anorexia Nervosa (pro-Ana) and pro-ED recovery). Results Seventy-eight patients (93.6% females, mean age 14.5 ± 2.1 years) were enrolled in the study. For 62.8%, TikTok represented the main SM, used for 1.4 ± 1.0 h/day, with diet (21.8%) as the most frequently used topic category. Pro-Ana and pro-ED recovery contents (“#foryou” and “#edrecovery” as the most frequent, respectively) were both actively searched by patients and proposed by the SM in a significant number of cases. For 59.0%, using TikTok reduced self-esteem, while 26.9% reported TikTok-related significant changes in their daily lives, and 3.8% reported experiences of body-shaming. Patients describing a negative effect of TikTok on their self-esteem more frequently searched and browsed “diet” ( p = 0.007) and pro-ED recovery ( p = 0.007) contents. Positive qualitative feedback on the SM was also reported. Conclusions This study documents the use of the SM TikTok among children and adolescents with ED. Individuals with a perceived negative effect of this SM on their self-esteem may show greater interaction with specific content. Further studies are needed to investigate the psychopathological factors influencing the relationship between ED and the use of SM.",2022,2022-12,Italian Journal of Pediatrics,48,1,138,,10.1186/s13052-022-01308-4,,#271,Pruccoli 2022,"Hayden Fernandes (2026-04-07 07:33:49)(Select): TikTok use is associated with both negative and positive experiencevs (reduced self-esteem to recovery). Participants who reported negative effects tended to engage more with diet-related and ED-related content. Observational study. Children and adolescents are all in a specialist eating disorder service. Anonymous paper-based survey. Jan-Feb 2021, COVID-19 lockdown in Italy. Self-reported bias.

RQ1 - How do under 25s interact with social media?: Users actively search and browse specific topics. Engagement is not passive.

RQ2 - How does social media affect under 25s?: Mixed effects. Lower self-esteem with harmful content. Access to recovery or supportive content. Psychological impact depends on type of content and existing vulnerability of user.

RQ3 - How can social media be changed for positive benefit?: Reduce exposure to harmful content (e.g. diet, pro-ED). Promote supportive/recovery content. Better content moderation.; ",HAYDEN; RQ1; RQ2
‘Falling down the rabbit hole’: a thematic analysis of young people’s views on TikTok algorithms and eating disorder content,"Parnell, Tamsin; Hunt, Daniel; Wilkins, Jessica; İnce, Başak; Sharpe, Helen; Schmidt, Ulrike; Bartel, Heike","Abstract Background TikTok’s algorithm is at the centre of its user experience. The platform, which allows users to create and consume short-form content, can enable young people (YP) to feel less alone when experiencing illnesses such as eating disorders (EDs) by encouraging them to build communities around mental health-related content. However, emerging research suggests TikTok’s algorithm might exacerbate ED symptoms by leading YP into spirals of ED content. This paper provides a lived experience perspective on what experiencing high volumes of ED content on TikTok’s For You Page (FYP) can be like for YP. Methods We conducted 17 semi-structured interviews in which participants (UK-based, aged 18–25, with experience of disordered eating or an ED) described their experiences of using TikTok. We identified three themes that express how participants interact with ED content on TikTok: (1) View One, See More, (2) Morbid Curiosity, and (3) From Helpful to Unhelpful. Theme 1 describes viewing one unhelpful video and then being exposed to more of this content on the FYP. Theme 2 refers to YPs descriptions of a strong impulse to view ED content when it surfaces on their FYP even if it is felt to be unhelpful. Theme 3 recounts YPs experiences of viewing potentially helpful content (e.g., pro-recovery videos) and then being presented with pro-ED content on the FYP. Through a close linguistic analysis, we examine how participants talk about how they feel when viewing ED content on TikTok. Findings Participants reported engaging regularly with ED content on TikTok. Their interactions with ED content show that the personalised nature of TikTok’s algorithm (which is sensitised to how long a user watches a video) can interact with and exacerbate some ED behaviours and psychologies, leading some YP into what they describe as negative echo-chambers of ED content. Conclusion Platforms should assume greater responsibility for their algorithms’ roles in intensifying ED symptoms and improve the efficacy of functions that help users control the content they see. A greater awareness of the role of TikTok in exacerbating ED thoughts and behaviours among mental health professionals is also necessary.",2025,2025-12,Journal of Eating Disorders,14,1,27,,10.1186/s40337-025-01505-6,,#280,Parnell 2025,"Hayden Fernandes (2026-04-07 06:42:14)(Select): Qualitative interviews show TikTok content shifts from helpful (e.g. recovery) to harmful (e.g. pro-ED). Algorithm escalation, see one, see more. Mixed content exposure. Algorithm design is central role in shaping user experience and MH risk. 18-25 yos. Small sample size. Self-reported bias.

RQ1 - How do under 25s interact with social media?: Interaction is shaped by algorithms, not just user choice. Watching and engaging due to curiosity. Passive and active interaction.

RQ2 - How does social media affect under 25s?: Algorithms can reinforce ED thoughts and behaviours, create echo chambers of harmful content. SM has content amplification methods, not just the content itself.

RQ3 - How can social media be changed to have the largest positive benefit to under 25s?: Take responsibility for algorithmic amplification of harmful content. Improve. control over recommendations. Increase transparency of algorithms. Reduce reinforcement loops of harmful content.; ",HAYDEN; RQ2
"Wounds of the past, screens of the present: how childhood adversities shape social media behaviours in adulthood","Kovacic, Matija; Orso, Cristina Elisa","Abstract This paper explores whether individuals that grew up in adverse environments are more likely to engage in harmful use of social media later in life. We rely on the first EU-wide, individual-level survey that comprises information on social media usage time, patterns, motivations, and potential overuse, together with a rich set of socio-economic conditions, experiences of loneliness, and traumatic events in childhood of individuals residing in 27 European member states. We find that the presence of close relatives with severe drinking and mental health problems during childhood is positively associated with excessive use of social media in adulthood. Adverse childhood environments have a significant impact on passive overuse of digital platforms, leading to increased neglect of work and family responsibilities. The results also indicate interesting geographical patterns as well as gender and cohort effects, with younger male individuals and those living in Northern and Eastern European countries being particularly affected. Finally, we show that the childhood environment spillovers are, to some extent, mediated by loneliness and social isolation in adulthood. Our findings have significant policy implications since the interplay between the excessive social media use and adverse childhood experiences may jointly undermine individuals’ well-being and cognitive development, representing a pressing public health issue.",2025,2025-12,Review of Economics of the Household,23,4,1323–1369,,10.1007/s11150-025-09796-z,,#283,Kovacic 2025,"Sam Ndenecho (2026-04-12 07:21:14)(Select): Relevance: Not overly relevant, but still within RQ1 (How do <25s use social media).

Warning: This paper uses a cross-section of the EU27, but looks at those of all ages (16-65+) and how childhood adversities effect social media use (and SM addiction, passive use).

Although this explores those outside of the age range, this paper addresses a lot of questions re. demographics and how different kinds of people use SM differently. The main takeaway here is that social media is often more likely to be problematically (e.g. passively, by addiction) used by already vulnerable groups, which can make their mental health situations increasingly worse and develop into a downwards cycle. The authors argue that there is a need for more interventions for young people <16s both in the physical world, and in cyberspace.

Very well-made paper.; ",SAM
Depression and social media addiction among teenagers in a longitudinal study with dual moderation,"Liu, Pingfan; Wang, Jingbo; Zuo, Qiangzhi; Han, Tong; Zhang, Junwei",,2026,2026-02,Scientific Reports,,,,,10.1038/s41598-026-38729-8,,#289,Liu 2026,"Grace Gilman (2026-03-27 03:36:50)(Select): Good paper, aligns with research area, comes up with good conclusions(avoiding negative emotions and not being able to articulate your emotions moderate depression and social media addiction). Has some study problems which are highlighted in pink; ",GRACE; RQ1
The mental health and well-being profile of young adults using social media,"Di Cara, Nina H.; Winstone, Lizzy; Sloan, Luke; Davis, Oliver S. P.; Haworth, Claire M. A.","Abstract The relationship between mental health and social media has received significant research and policy attention. However, there is little population-representative data about who social media users are which limits understanding of confounding factors between mental health and social media. Here we profile users of Facebook, Twitter, Instagram, Snapchat and YouTube from the Avon Longitudinal Study of Parents and Children population cohort ( N = 4083). We provide estimates of demographics and mental health and well-being outcomes by platform. We find that users of different platforms and frequencies are not homogeneous. User groups differ primarily by sex and YouTube users are the most likely to have poorer mental health outcomes. Instagram and Snapchat users tend to have higher well-being than the other social media sites considered. Relationships between use-frequency and well-being differ depending on the specific well-being construct measured. The reproducibility of future research may be improved by stratifying by sex and being specific about the well-being constructs used.",2022,2022-09,npj Mental Health Research,1,1,11,,10.1038/s44184-022-00011-w,,#296,DiCara 2022,"Sam Ndenecho (2026-03-26 17:29:50)(Select): Relevancy: Good for RQ1 (""how do they use?"")
Platforms: Facebook, Twitter, Instagram, Snapchat and YouTube

Method: using participants (N=4083) from an existing longitudinal study of UK data, looking at usage, and affect on EDs, self-harm, but also +ve aspects across demographics (sex, ethnicity, A-level attainment, class)? They use self-reported measures.

Looking at (mean) ages around 23-24 -- towards the end of the scale. Looking at statistically significant demographics: only sex was significant when predicting usage of social media, not by deprivation.
They used three buckets for frequency of social media use: ""≤1/day"", ""2-10"", "">10"".

There is some limited evidence for a non-linear ""Goldilocks"" effect for some metrics (self-harm, suicidal thoughts), where using it semi-frequently leads more benefit than not, but this is not consistent.

Across platforms and sexes, YouTube had a statistically significantly greater mean for % of users who scored highly for depression, self-harm, and suicidal thoughts, especially for females. Other platforms had reduced % of users who scored highly on EDs, depression, self-harm, suicidal thoughts compared to all users of the five platforms. One potential explanation authors discuss is that YouTube is much more of a ""passive"" social media than the others, where users mainly consume content rather than communicate.

; ",RQ1; SAM
Behavioural symptoms of mental health disorder such as depression among young people using Instagram: a systematic review,"Adeyanju, Gbadebo Collins; Solfa, Ron Patrick; Tran, Thuy Linh; Wohlfarth, Sophia; Büttner, Jonas; Osobajo, Oluyomi A.; Otitoju, Afolabi","Abstract There is a growing debate on the linkage between social networking platforms and mental health disorder, such as depressive behaviour or depression. However, the relationship between Instagram use and depression or depressive behaviour has not been exhaustively examined. This review aims to examine these two variables. Only peer-reviewed journal articles that are published between October 2010 and December 2018 were sought in central and journal databases. Studies were selected based on predefined criteria and assessed for risk of bias and quality of evidence using GRADE. One thousand eight hundred fifty-six studies were the outcome of the search, out of which 9 meets all eligible criteria. Of the 9 studies, three-quarter was published between 2017 and 2018, covering five continents: (North America: 3; Asia: 2; Australia: 2; South America: 1, Europe: 1). The final included studies broadly examined young Instagram users between the age of 19 and 35. The synthesis affirmed a linkage between Instagram and symptoms of depression or depressive behaviour. Variables that moderate this relationship are social comparison, self-esteem built on validation and approval of others, social media dependence, gender, negative or insufficient feedback, poor self-rated attractiveness, Instagram broadcasting and loneliness, younger users and risk of anxiety, and the number of strangers that users follow. There is a strong relationship between Instagram use and mental health disorders such as depression or depressive behaviour; however, no in-depth direct causality is proven yet. Further studies are needed to unravel the direct causality puzzles.",2021,2021-12,Translational Medicine Communications,6,1,15,,10.1186/s41231-021-00092-3,,#299,Adeyanju 2021,"",HUGO; review
Unravelling the veil of appearance anxiety: exploring social media use among Chinese young people,"Wu, Yihan; Xue, Ying; Zhao, Xiaohan; Han, Sijia; Wu, Weiyun","Abstract The purpose of this study is to explore the relationship between appearance anxiety and social media use among Chinese adolescents. Using a grounded theory approach, the study conducted two-round online interviews with ten Chinese university students and subsequently constructed a theoretical model of social media appearance anxiety among Chinese young people. The results of the study indicate that social media has a dual impact on appearance anxiety. On one hand, increased social media engagement amplifies appearance anxiety by shaping aesthetic standards and fostering comparative environments. On the other hand, diverse aesthetic perspectives and authentic presentations on social media partially alleviate appearance anxiety by promoting acceptance of unique appearances and boosting self-confidence. It is emphasized in this study that there should be an in-depth understanding of the dual impact and complicated relationship of social media on the daily lives of Chinese adolescents to further develop relevant strategies that promote healthy social media behavior among youth. Furthermore, this study calls for efforts to actively promote the healthy image and psychological well-being of adolescents while alleviating the negative impact of appearance anxiety and overall mental health. Such efforts are needed to ensure a positive and healthy development for the younger generation.",2024,2024-01,BMC Psychology,12,1,9,,10.1186/s40359-023-01495-7,,#304,Wu 2024,"Sam Ndenecho (2026-04-10 21:14:03)(Select): Relevance: RQ2 — not too relevant, but useful to quote, as they interviewed 10 Chinese college-aged students.

A unique contribution out of study is that it also shows that young men also experience appearance anxiety too, and that there is a gap in the literature there. We could briefly outline the difference between men's and women's issues in the introduction too.; ",RQ2; SAM
"TikTok, teens and mental health: quantifying algorithmic exposure to harmful content","Gannon, John; O’Hanlon, Freya; Conroy, Niall",,2025,2025-12,Irish Journal of Medical Science (1971 -),,,,,10.1007/s11845-025-04244-4,,#305,Gannon 2025,"Sam Ndenecho (2026-03-26 18:39:23)(Select): Relevance: RQ2 territory.  Not really that great. Maybe can be used in conjunction with something else to make the argument that the current generation of recommendation algorithms promote harmful content to users. But the sample size is so small! 

Platforms: TikTok
Ages: 13–15 years old

Summary: Gannon, et al. tested the existing safety policies of TikTok by creating four fake profiles to simulate 13- and 15-year-old x male and female users, intentionally showing an interest in risky topics to see if the algorithm would continually recommend problematic content to adolescent-aged users.

Methodology: each user scrolled on the ""For You"" feed for three hours continuously, intentionally scrolling through and stopping to watch ""recognised risk domains in adolescent mental health"" such as ""conflict"", ""mental health"", ""drugs and alcohol"", ""diet and body image"". The researchers then manually reviewed the footage and claim that 4.2% of videos shown violated TikTok's own guidelines. Demographic-wise, this rose to 8.2% for the 15-year-old female user (for problematic videos on diet and body image) with other problem topics around 3-5% for other demographics.

Opinions: the authors use this as evidence to claim that voluntary self-policing by social media companies is ""insufficient"". ; ",RQ2; SAM
Child and Adolescent Engagement with Climate Change on Social Media and Impacts on Mental Health: a Narrative Review,"Parnes, McKenna F.; Amort, Brendan; Calderon-Smith, Cayetana; Chambers, Earle C.; Musicaro, Regina",,2024,2024-09,Current Pediatrics Reports,12,4,158–167,,10.1007/s40124-024-00331-9,,#307,Parnes 2024,"Hayden Fernandes (2026-04-07 07:09:55)(Select): Article with references. SM can be used to learn about climate change, but it increases exposure to distressing content. Children and adolescents. Narrative (not systematic) review - selection bias. Focuses on climate-related content.

RQ1 - How do under 25s interact with social media?: Consume information, engage in communities, and activism. Interaction is purpose-driven and issue-focussed, not just socialising. Identity. values.

RQ2 - How does social media affect under 25s?: Increased awareness, sense of activism. Climate anxiety. Emotional distress from exposure to negative content. Empowering but also overwhelming.

RQ3 - How can social media be changed to have the largest positive benefit to under 25s?: Reduce misinformation. Limit exposure to overly distressing content. Encourage supportive communities and positive engagement (e.g. activism, solution-focused content). Support credible information sources.; ",HAYDEN; RQ2; review
"Time Spent on Social Media and Associations with Mental Health in Young Adults: Examining TikTok, Twitter, Instagram, Facebook, Youtube, Snapchat, and Reddit","Woodward, Matthew J.; McGettrick, Caitlin R.; Dick, Olivia G.; Ali, Mawsoof; Teeters, Jenni B.","Abstract Time spent on social media has been an inconsistent predictor of mental health outcomes in young people. However, most studies have assessed social media use globally, with few investigations of the relative influence of specific social media platforms, which may partially account for mixed findings. Furthermore, studies often focus on a single mental health outcome, limiting understanding of how social media relates to psychological well-being. The purpose of the current study was to examine associations between time spent on multiple popular social media platforms and a variety of mental health-related outcomes in a sample of young adults. Participants included 575 young adults who completed an online survey assessing self-reported time spent on Twitter, TikTok, YouTube, Instagram, Reddit, Snapchat, and Facebook as well as depression, anxiety, PTSD, loneliness, friend support, and self-esteem. Path analyses showed that in the overall sample, greater use of Tiktok and YouTube were consistently associated with more mental health issues, whereas greater use of Snapchat was associated with fewer mental health issues. Models examining results for men and women separately suggested that use of Tiktok was more relevant in women’s mental health, whereas use of Reddit was more relevant in men’s mental health. Findings highlight that associations are not uniform across social media platforms. More research is needed that compares individual platforms and their relationship to psychological well-being as well as future studies examining how gender impacts findings.",2025,2025-01,Journal of Technology in Behavioral Science,10,3,661–671,,10.1007/s41347-024-00474-y,,#313,Woodward 2025,"Sam Ndenecho (2026-04-03 23:34:52)(Select): Pretty relevant 18–25 years, but self-reported time of usage, which is a flaw, but goes into the effect of using particular platforms, and goes a bit into asymmetries of effects depending on gender.; ",RQ2; SAM
The mediating role of mental health in the relationship between childhood experiences and social media use disorder among university students: a mixed-methods study,"Bakır, Vedat; Dilmaç, Bülent","Abstract This mixed-methods study examines the impact of childhood trauma and family dynamics on mental health and the development of social media use disorder (SMUD) among university students. Through a combination of quantitative and qualitative methods, this research offers a comprehensive investigation into how early life experiences influence social media addiction and the mediating role of mental health. The independent variable is childhood experiences, the dependent variable is social media use disorder, and mental health serves as the mediating variable. The study, conducted in 2024 with a sample of 330 university students, employs correlation analysis and mediation testing, with bootstrapping used to evaluate the significance of indirect effects. The results demonstrate that mental health issues, such as depression, anxiety, and stress, mediate the relationship between childhood experiences and social media use disorder. Structural Equation Modeling (SEM) further reveals that adverse childhood experiences contribute to mental health challenges in adulthood, which in turn exacerbate social media addiction. Qualitative findings offer rich insights into how social media affects daily routines, family interactions, and psychological well-being, revealing its central role in the participants’ lives. Moreover, this study highlights how childhood experiences shape social media use patterns. These findings significantly advance the understanding of the complex interplay between early life trauma, mental health, and social media use, addressing critical gaps in the literature on digital addiction.",2025,2025-03,Current Psychology,44,5,3444–3457,,10.1007/s12144-025-07427-5,,#314,Bakır 2025,"Hugo Whittome (2026-04-08 23:21:16)(Select): Additionally, anxiety, depression, and stress have
been found to positively and significantly influence social
media use disorder. However, it is understood that family
and personal/social experiences do not significantly predict
social media use disorder. Although there is no direct relationship between family and personal/social experiences
and social media use disorder, it can be suggested that anxiety, depression, and stress partially mediate this relationship.
Furthermore, the mediating role of anxiety, depression, and
stress is significant in the relationship between school experiences and social media use disorder.; Hugo Whittome (2026-04-08 23:15:26)(Select): Is focused on whether mental health affects social media usage (which is really good to mention due to the potential that it is this way round and not the other); ",HUGO; Long; RQ1; RQ2
