Title,Authors,Abstract,Published Year,Published Month,Journal,Volume,Issue,Pages,Accession Number,DOI,Ref,Covidence #,Study,Notes,Tags
"Vulnerability to appearance-based social media use and preoccupation: A model of young women’s appearance values, depression, and self-esteem via uses and gratification","Seeto, Charlie-Jean; Uhlmann, Laura R.; Zimmer-Gembeck, Melanie J.; Donovan, Caroline L.","Theory and research suggest that women's general affective and appearance-related vulnerabilities are precursors of social media use, with the associations mediated by gratifications sought from social media, such as affection-seeking. To test this, we examined whether the vulnerabilities of low self-esteem, depression, thin-ideal internalisation, appearance perfectionism and appearance-contingent self-worth had indirect associations with appearance-based social media use/preoccupation via social media gratifications of escape, socialising, and affection-seeking. Social media use/preoccupation included general appearance-related activity, self-presentation, and social comparison when online. Participants were 405 young women (Mage = 19.95, SD = 2.70) who completed surveys. In a path model, all vulnerabilities but depressive symptoms were related to more escape and/or socialising gratification and there were three small indirect associations with appearance-based social media use/preoccupation, two for self-esteem (via escape and socialising) and one for thin-ideal internalisation (via socialising). In addition, the three appearance-specific individual vulnerability factors were directly related to appearance-based social media use/preoccupation. Overall, appearance-related vulnerabilities had mostly direct relations with increased appearance-based social media use/preoccupation. In contrast, self-esteem had indirect associations with appearance-based social media use/preoccupation, which were sometimes counterintuitive, and depressive symptoms had little unique impact on gratifications or on appearance-based social media use/preoccupation once other vulnerabilities had been considered.",2026,2026,Body Image,56,,102034,,https://doi.org/10.1016/j.bodyim.2026.102034,,#219,Seeto 2026,"Hayden Fernandes (2026-04-03 06:43:49)(Select): Focus on appearance-based social media use. Psychological vulnerabilities of low self-esteem, depression, thin-ideal internalisation. Motivations of affection-seeking, socialising, escapism. Use of SM is not random, but driven by psychological needs and vulnerabilities.

No explicit age range. Only ""young women"".

Self-reported survey.

Cannot establish causation. Self-report bias (may misreport). Gender-specific. Focuses on body image and appearance-based use.

RQ1: How do under 25s interact with social media?
Appearance-focused study, shows appearance-based interactions, like viewing and comparing images, seeking validation through likes and comments. Use SM for affection-seeking, socialising and escapism. Interaction is often motivated by psycological needs, not just entertainment.

RQ2: How does social media affect under 25s?
Vulnerable individuals are more likely to engage in appearance-focused used. SM can amplify existing vulnerabilities.

RQ3: How can social media be changed to have the largest positive benefit to under 25s?
Platforms should reduce emphasis on appearance-based validation (likes, comparisons). Support healthier motivations for use, such as positive self-expression. From validation-oriented to wellbeing-oriented. Perhaps through reducing visibility of metrics (likes/follow).; ",HAYDEN; RQ1
"Social Media Use, Quality of Life, and Recovery From Depression and Anxiety in Young People From Deprived Urban Areas: A Longitudinal Study in South America","Lucchetti, Santiago César; Brusco, Luis Ignacio; Diez-Canseco, Francisco; Gomez-Restrepo, Carlos; Carbonetti, Fernando; Fung, Catherine; Uribe-Restrepo, José Miguel; Flores, Sumiko; Godoy-Casasbuenas, Natalia; Carbonel, Adriana; Sureshkumar, Diliniya Stanislaus; Priebe, Stefan","Background Young people in South America's deprived urban regions are at heightened risk for mental disorders. High social media engagement (SME) – the intensity of use and emotional connection to social platforms – is associated with depression and anxiety, but its role in symptom persistence or recovery remains unclear. Objective To assess if SME changes in young people from deprived urban areas of South America with depression/anxiety link to improvement of symptoms or quality of life (QoL). Methods A longitudinal study assessed 1280 participants with depression and/or anxiety at baseline. We used the Multidimensional Facebook Intensity Scale (MFIS, SME), Patient Health Questionnaire (PHQ-8, depression), General Anxiety Disorder (GAD-7, anxiety), and Manchester Short Assessment (MANSA, QoL). At 12- and 24-month follow-ups, 1255 and 1013 participants were analyzed. Analyses included descriptive statistics, Pearson correlations, ANOVA, and Games–Howell post hoc tests. Findings Higher SME levels were associated with higher depression/anxiety scores at all time points. Participants who reduced or maintained stable SME showed significantly greater improvements in depression and QoL compared to those who increased SME. Conclusions Reducing SME or fostering healthier engagement may be clinically relevant to reduce depression and anxiety risk and improve QoL. Future research should explore intervention efficacy. Resumen Antecedentes Los jóvenes de áreas urbanas desfavorecidas de Sudamérica presentan un alto riesgo de desarrollar trastornos de salud mental. El alto compromiso con las redes sociales (CRS) —la intensidad y el compromiso emocional con su uso— se asoció con depresión y ansiedad anteriormente, pero su impacto en la persistencia o recuperación de síntomas es incierto. Objetivo Evaluar si los cambios en el CRS en jóvenes de áreas urbanas desfavorecidas con depresión/ansiedad se relacionan con la mejora de síntomas o de la calidad de vida (CV). Métodos Estudio longitudinal con 1.280 participantes con depresión y/o ansiedad. Se usaron las escalas Patient Health Questionnaire (PHQ-8, depresión), General Anxiety Disorder (GAD-7, ansiedad), Manchester Short Assessment (MANSA, CV) y Multidimensional Facebook Intensity Scale (MFIS, CRS). En los seguimientos a 12 y 24 meses se analizaron 1.255 y 1.013 participantes. Los análisis incluyeron estadísticas descriptivas, correlaciones de Pearson, ANOVA y pruebas post hoc de Games-Howell. Resultados Niveles más altos de CRS se asociaron con mayores puntajes de depresión/ansiedad en todos los puntos de evaluación. Reducir o mantener estable el CRS se asoció a mejoras significativamente mayores en depresión y CV en comparación con aumentar el CRS. Conclusiones Reducir el CRS o fomentar un uso saludable puede ser clínicamente relevante para reducir el riesgo de depresión y ansiedad, y para mejorar la CV. Se deben investigar intervenciones efectivas.",2025,2025,Revista Colombiana de Psiquiatría,54,,52-61,,https://doi.org/10.1016/j.rcp.2025.07.004,,#220,Lucchetti 2025,"Grace Gilman (2026-04-01 00:47:55)(Select): observational study of depressed/anxious youths, using validated surveys over 2 year period. shows strong correlation between increase in social media use and worsening depression. Can not show any causality.; ",GRACE; RQ1; RQ2
Mindfulness as a mediator in the relationship between social media engagement and depression in young adults,"Jones, Amelia; Hook, Megan; Podduturi, Purnaja; McKeen, Haley; Beitzell, Emily; Liss, Miriam","Social media engagement has been inconsistently linked to depression and it is important to determine whether specific motivations for engagement are linked to depression and what the mechanisms may be. This study investigated five factors of mindfulness as potential mediators between behavioral, affective, and cognitive social media engagement and depression. Participants (between 17 and 24 years old) at a university or found through social media (Reddit, Facebook, and Instagram; N = 371) were given the Five Factor Mindfulness Questionnaire (FFMQ), the Social Media Engagement Scale for Adolescents (SMES-A), and the Patient Health Questionnaire (PHQ-8), which measured depression. The awareness facet of mindfulness significantly mediated the relationship between all three social media engagement subscales (behavioral, affective, and cognitive) and depression. Additionally, there was a significant mediation between the affective engagement subscale and depression by the nonjudge, nonreact, and describe facets of mindfulness. Our results suggest that mindfulness is an important mechanism of the relationship between social media engagement and depression. The implementation of mindfulness-based interventions (MBIs) may be useful to help teach how to engage in social media mindfully and positively.",2022,2022,Personality and Individual Differences,185,,111284,,https://doi.org/10.1016/j.paid.2021.111284,,#229,Jones 2022,"Sam Ndenecho (2026-04-10 03:43:37)(Select): Relevancy: Useful for RQ2 in a wider discussion around how social media affects young people differently.

Summary: This study primarily looks at various proxies for mindfulness and tries to test if they are mediators for depression from social media engagement.; ",RQ2; SAM
The Use of Social Networking Sites in Mental Health Interventions for Young People: Systematic Review,"Ridout, Brad; Campbell, Andrew","Background The onset of mental health problems peaks between adolescence and young adulthood; however, young people face barriers to treatment and are often reluctant to seek professional help. Many are instead seeking support and information regarding their mental health via the Web, especially via social networking sites (SNSs), and hence, there is a promising opportunity to use SNSs to deliver or integrate with youth-focused online mental health interventions. Previous reviews have evaluated the effectiveness of SNSs for specific disorders in young people; however, none of the reviews have covered the breadth of SNS–based youth mental health interventions available across all mental health issues. Objective This review aimed to systematically identify available evidence regarding the use of SNS–based interventions to support the mental health of young people aged up to 25 years, to evaluate their effectiveness, suitability, and safety, and identify gaps and opportunities for future research. Methods The PubMed and PsycINFO databases were searched using Medical Subject Headings terms and exploded keywords and phrases. Retrieved abstracts (n=974) were double screened, yielding 235 articles for screening at the full-text level. Of these, 9 articles met the review inclusion criteria. Given the small number of studies, and the variety of outcome measures used, a quantitative meta-analysis was not possible. Results The 9 articles (quantitative studies, qualitative studies, and descriptions of the iterative design process) covered 5 separate interventions. Of the 5 interventions, 2 interventions used purpose-built platforms based on the moderated online social therapy (MOST) model, 2 used Facebook, and 1 evaluated a purpose-built mobile app. The 2 MOST interventions targeted specific mental health issues (depression and psychosis), whereas the others focused on improving mental health literacy, social support, and general well-being. Only 3 quantitative studies were identified, and all used a pre-post design (without a control group) to establish proof of concept. Of the outcome variables assessed, there were significant improvements in mental health knowledge and number of depressive symptoms but no improvement in anxiety or psychosis symptoms. Acceptability of and engagement with the SNS platforms were generally high, as were perceptions of usefulness and safety. Moderation by clinical experts was identified as a key component of the more successful interventions. When offered a choice, users showed a preference for mobile apps over Web-based interfaces. Conclusions The evidence reviewed suggests young people find SNS–based interventions highly usable, engaging, and supportive. However, future studies need to address the current lack of high-quality evidence for their efficacy in reducing mental health symptoms. Given young people are already turning to SNSs to engage in knowledge seeking and peer-to-peer support, SNS–based youth mental health interventions provide an opportunity to address some of the barriers young people face in accessing qualified mental health support and information.",2018,2018,Journal of Medical Internet Research,20,12,,,https://doi.org/10.2196/12244,,#231,Ridout 2018,"Hayden Fernandes (2026-04-04 07:46:06)(Select): Great for RQ3. Age range perfect. Finds young people use SM to seek mental health information and peer support. SNS interventions (such as Facebook groups) are engaging and perceived as useful and supportive. Some interventions showed improvements in depressive symptoms and mental health knowledge. Strong potential to use SM as an intervention tool. Systematic review. Small number of studies included (9).

RQ1 - How do under 25s interact with social media?: Young people use social media to seek mental health information and engage in peer-to-peer support. They prefer interactive and community-based platforms. Interactions are support-seeking and community-driven, not just socialising.

RQ2 - How does social media affect under 25s?: SNS-based interventions can improve mental health knowledge, reduce depressive symptoms, reducing barriers to accessing support (stigma, accessibility).

RQ3 - How can social media be changed to have the largest positive benefit to under 25s?: Interventions shold include professional moderation, and platforms should facilitate peer support communities and for them to be engaging and accessible (mobile-friendly).; ",HAYDEN; RQ3; review
Validation of the Appearance-Related Social Media Consciousness Scale with Chinese adolescents and young adults,"Tie, Bijie; Yang, Xiongjian; Qiu, Jiang","Research has revealed a negative association between appearance-related social media consciousness (ASMC) and mental health, but the impact of this association in the Chinese population remains understudied. This study examined the psychometric properties of the ASMC scale among Chinese adolescents and young adults and to further investigate the scale’s measurement invariance and differences in ASMC across gender and age groups. Exploratory and confirmatory factor analyses were conducted to examine the ASMC scale’s factorial structure among Chinese adolescents and young adults, including 1109 adolescents (50.0% boys) aged 12–18 (mean, 14.89) years and 457 young adults (42.5% men) aged 18–25 (mean, 20.75) years. The measurement invariance across gender and age groups, internal consistency and convergent validity were examined. ASMC scale was found to have a unidimensional structure and to be invariant across gender and age groups. It exhibited excellent internal consistency and strong construct validity. Moderate gender differences and pronounced age differences in ASMC scale scores were observed. Our findings support the validity of the ASMC scale as an effective instrument for the measurement of appearance-related social media consciousness experience among Chinese young adults and adolescents. Further study is required to evaluate the status of ASMC as a risk factor for disordered eating and target for preventive interventions within Chinese samples.",2024,2024,Body Image,48,,101677,,https://doi.org/10.1016/j.bodyim.2023.101677,,#233,Tie 2024,"Hayden Fernandes (2026-04-04 07:53:39)(Select): Appearance-related social media consciousness (ASMC) is a measurable psychological construct and can be a risk factor for body image issues and mental health problems. Data is focused on measuring a psychological construct, not the behaviour directly. Self-reported data has bias risk. Chinese sample.

RQ1 - How do under 25s interact with social media?: Users engage with social media in a way that involves constant awareness of appearance and perception by others. Interaction includes comparing appearances and managing self-presentation. Highly self-conscious and appearance-driven interactions.

RQ2 - How does social media affect under 25s?: SM can increase appearance monitoring. Higher ASMC links to body image concerns and mental health risks.

RQ3 - How can social media be changed to have the largest positive benefit to under 25s?: Platforms should reduce appearance-focused pressures. Reduce appearance comparison features. Promote more diverse and authentic representations. Less emphasis on visual perfection.; ",HAYDEN; RQ2
"The impact of Instagram on young Adult's social comparison, colourism and mental health: Indian perspective","Sharma, Aparna; Sanghvi, Kavish; Churi, Prathamesh","This paper explores persuasive issues such as Social Comparison, Colourism, and Mental Health and their relationship with Instagram use, focusing on young adults living in India. Participants (N = 726) were recruited to fill up a questionnaire, and the self-reported data was used to test our hypothesis. The study followed a correlational, non-experimental approach to investigate the mediation models as proposed. Structural Equational Modelling eluded a positive and significant relationship between age and the social issues with control variables as the frequency and time spent on Instagram. Moreover, it was found that social comparison can lead to colourism and mental health issues. Gender was, however, found to have insignificant relation with three parameters. Qualitative analysis was supported to find important implications for all Instagram stakeholders. Discussions were drawn indicating the need to raise awareness regarding these issues to enjoy social media while safeguarding the user's well-being. The paper provides critical key findings delving into the realms of these parameters, and such implications are further discussed to understand its reflection in online spaces.",2022,2022,International Journal of Information Management Data Insights,2,1,100057,,https://doi.org/10.1016/j.jjimei.2022.100057,,#235,Sharma 2022,"Hayden Fernandes (2026-04-08 04:09:23)(Select): Increased Instagram use leads to higher social comparison, leading to higher colourism and mental health issues. Young adults. Online questionnaire, self-report bias. Specific to India. Specific to Instagram. Online recruitment has potential for sampling bias.

RQ1 - How do under 25s interact with social media?: Interaction is highly comparative, comparing appearance, lifestyle and popularity. Engagement is shaped by metrics (likes, follows) and visuals (images, filters). Highlights active self-presentation and comparison, not just passive.

RQ2 - How does social media affect under 25s?: Negative psychological pathways. Creates social comparison and leads to colourism and mental health issues. Social media indirectly affects users. Working through mediators like comparison. Heavier use leads to stronger negative effects.

RQ3 - How can social media be changed to have the largest positive benefit to under 25s?: Reduce comparison and emphasis on likes/followers (quantified popularity metrics). Increase awareness of harmful norms (beauty standards, colourism). More authentic representation.; ",HAYDEN; RQ2
Social Media and Depressive Symptoms in Childhood and Adolescence: A Systematic Review,"McCrae, Niall; Gettings, Sheryl; Purssell, Edward",,2017,2017-12,Adolescent Research Review,2,4,315–330,,10.1007/s40894-017-0053-4,,#245,McCrae 2017,"Grace Gilman (2026-04-01 04:42:48)(Select): Systematic review that looks at <18s with good split between data based on gender. Finds evidence for correlation between social media use and depression. Not causative, quality of studies found varied. Some found the opposite relation between depression and social media use. Many of the studies are quite outdated and did not use validated methods.; ",GRACE; RQ1; RQ2; review
Childhood Emotional Maltreatment and Problematic Social Media Use Among Adolescents: The Mediating Role of Body Image Dissatisfaction,"Kircaburun, Kagan; Griffiths, Mark D.; Billieux, Joel","Abstract Preliminary evidence suggests that childhood maltreatment is associated with higher problematic social media use (PSMU). It has also been established that childhood emotional maltreatment (CEM) is associated with body image dissatisfaction (BID). However, the direct and indirect impacts of CEM on PSMU via BID remain untested. The present study examined these direct and indirect relationships among a sample of 385 adolescents (mean age 15.62 years, range 14–18 years). Results indicated that female adolescents had higher levels of CEM, BID, and PSMU compared to males. Structural equation modeling indicated that CEM was indirectly associated with PSMU via BID among males. However, only BID was positively associated with PSMU among females. The findings are in accordance with theoretical models suggesting that individuals’ core characteristics including early childhood experiences and psychopathological factors are associated with different types of specific internet-use disorders.",2020,2020-12,International Journal of Mental Health and Addiction,18,6,1536–1547,,10.1007/s11469-019-0054-6,,#249,Kircaburun 2020,"Sam Ndenecho (2026-04-11 09:13:12)(Select): Relevancy: More about RQ1, but also covers some small part of RQ2.

The study explores how maltreatment during adolescence and childhood correlates with younger teens' social media use. In particular, this study outlines differences between boys and girls, and   discusses explanations using existing knowledge in psychology.

If we are to make a wider point from this and other studies, it is that often social media is part of a self-fulfilling cycle, and it can amplify existing negative effects (or indeed positive ones, too!); ",SAM
How do Australian social media users experience self-harm and suicide-related content? A National cross-sectional survey comparing young people and adults,"Robinson, Jo; La Sala, Louise; Kenny, Bridget; Cooper, Charlie; Lamblin, Michelle; Spittal, Matthew; Gao, Caroline; Kunin, Marina; Nicholas, Angela; Rezwan, Atria; Gifford, Maddox; Pirkis, Jane; John, Ann",,2025,2025-12,BMC Public Health,26,1,384,,10.1186/s12889-025-25646-0,,#270,Robinson 2025,"Hayden Fernandes (2026-04-07 07:50:06)(Select): Young people refered to 15-15 yos. Also includes adults 26+. Large national sample. Over half population had been exposed to content. Young people significantly more likely to be exposed than adults. Exposure often worsened mood, and minority reporting engaging in SH as a result. Many used SM to seek support. Self-reported bias.

RQ1 - How do under 25s interact with social media?: Passive exposure. Active searching, posting and seeking support. Algorithm strengthens prior behaviour, leading to more exposure.

RQ2 - How does social media affect under 25s?: Worsened mood of most users. Behavioural imitation in some cases (SH after exposure). SM can be supportive, offering connection and stigma-free help. Impact is context-dependent. Passive is more harmful, active is more beneficial.

RQ3 - How can social media be changed for positive benefit?: Reduce exposure to harmful content. Limit graphoc or imitative content. Content warnings. Helpline linkes embedded in posts.; ",HAYDEN; RQ2
