Title,Authors,Abstract,Published Year,Published Month,Journal,Volume,Issue,Pages,Accession Number,DOI,Ref,Covidence #,Study,Notes,Tags
Adolescent Social Media Use and Mental Health in the Environmental Influences on Child Health Outcomes Study,"Blackwell, Courtney K.; Mansolf, Maxwell; Rose, Theda; Pila, Sarah; Cella, David; Cohen, Alyssa; Leve, Leslie D.; McGrath, Monica; Neiderhiser, Jenae M.; Urquhart, Audrey; Ganiban, Jody M.","Purpose Research on adolescent social media use focuses on negative mental health outcomes, with less attention on potential positive outcomes. The current study addresses this limitation by investigating associations between adolescent social media use and both psychological well-being and psychopathology. Methods Three US-based pediatric cohort sites participating in the National Institutes of Health Environmental influences on Child Health Outcomes study contributed cross-sectional survey data. Adolescents (13–18 years) self-reported the time spent and type of (active, passive) social media use, and their psychological well-being (Patient-Reported Outcome Measurement Information System [PROMIS] Life Satisfaction and Meaning and Purpose), psychopathology (Strengths and Difficulties Questionnaire and PROMIS Depressive Symptoms), and peer relationship quality (PROMIS Peer Relationships). We estimated associations between social media use and 4 mental health groups aligned to the dual factor model of mental health (high well-being/low psychopathology; high well-being/high psychopathology; low well-being/low psychopathology; low well-being/high psychopathology), and tested interactions with peer relationships. Models were adjusted for age, sex, race, ethnicity, and family income. Results Participants (N = 963) were sociodemographically diverse (22% income ≤130% federal poverty level; 42% adolescents of color). Elastic net regressions revealed more hours using social media increased the probability of being in the high psychopathology/low well-being group; adolescents with poor peer relationships spending ≥7 hours/day on social media had the greatest risk of poor mental health. Positive peer relationships were the strongest predictor of positive mental health. Discussion Peer relationships were the most meaningful contribution to adolescent mental health, and quality of social media use had little influence.",2025,2025,Journal of Adolescent Health,76,4,647-656,,https://doi.org/10.1016/j.jadohealth.2024.12.003,,#149,Blackwell 2025,"Hugo Whittome (2026-04-08 23:50:28)(Select): Note the magnitude of the above claim is extremely small and directionality is not confirmed; Hugo Whittome (2026-04-08 23:49:24)(Select): spending more hours on social media was associated with a lower probability of being in the positive mental health group

But mental health groups were self reported; Hugo Whittome (2026-04-07 22:55:25)(Select): Between 13 to 18 years, actually looks really good; ",HUGO; RQ1; RQ2
Can interventions be delivered on social media platforms to promote mental health in young people? – A systematic literature review,"Jackson, Jessica; Morton, Joshua Paul Irvin; Kirkman, Ann; Harrington, Tracey; Aledeh, Muhammad; Kotera, Yasuhiro","Background: Social media is central to young people’s daily lives and holds potential as a platform for mental health promotion. While concerns have been raised about its negative effects, emerging evidence suggests that social media can support interventions promoting psychological well-being. Objective: To examine whether interventions delivered via social media platforms can promote positive mental health and well-being in young people under 25 years old. Method: Following the Cochrane Handbook and PRISMA guidelines, this systematic review included studies from seven databases and grey literature sources. Eligible studies evaluated interventions using social media platforms to deliver mental health promotion to individuals under 25. Data extraction and risk of bias were conducted using JBI and GRADE frameworks. Results: Out of 1429 identified records, six studies met inclusion criteria. Interventions targeted stigma reduction, help-seeking, suicide prevention, and body image concerns. Platforms included Instagram, YouTube, WhatsApp, and Facebook. Co-designed and culturally tailored interventions demonstrated greater engagement. While short-term improvements in awareness, attitudes, and self-efficacy were reported, methodological limitations, such as small sample sizes, lack of control groups, unvalidated measures, and reliance on self-reports, limited generalisability and internal validity. Conclusion: Social media offers promise for promoting mental health in young people, particularly when interventions are co-designed and culturally adapted. However, evidence remains limited and methodologically weak. Future work should employ robust study designs, include longitudinal follow-ups, and address representational diversity to better understand the effectiveness and scalability of such interventions.",2026,2026,Mental Health & Prevention,41,,200492,,https://doi.org/10.1016/j.mhp.2026.200492,,#157,Jackson 2026,"Sam Ndenecho (2026-03-26 14:46:52)(Select): RELEVANCY: Not particularly relevabt, but good to quote for RQ3 regarding the need for interventions to be culturally sensitive and somewhat personal to the user.

A very recent review paper (of n=6) examining how social media can be used to promote positive mental health in <25s.

Platforms: WhatsApp, YouTube, Instagram, Facebook

Key findings:
- <25s engage with short-form content and engage more with content on platforms such as Instagram and YouTube rather than Facebook.
- Across the studies, most found a short-term boost from the interventions, but could not statistically prove that there were any longer-term positive effects from the interventions.
- ""Strategies such as story-telling, co-design, influencer involvement and cultural tailoring appear to enhance engagement.""
- They critique the methodology of these studies, mainly:
    - The use of unvalidated self-reported measures [very big one across many of our studies!]
    - Small sample sizes, which reduces effect size and therefore generalisability.
    - In existing literature, there is ""underrepresentation of key groups, such as young males and culturally diverse populations""; ",RQ3; SAM; review
"A systematic review of social media impact on psychological well-being among children, adolescents, and young adults in arab countries","Alansari, Amani N.; Alwawi, Abdallah; Salim, Amani; Tarawah, Nizar; Ksia, Amine; Zaazouee, Mohamed Sayed","Background Social media is a major part of daily life for youth worldwide, including in Arab countries. Although it offers avenues for connection and information, growing concerns exist around its psychological impacts. This review aims to synthesize existing evidence on the association between social media use and mental health outcomes among children, adolescents, and young adults in Arab countries. Methods We systematically searched PubMed, Scopus, EMBASE, and Web of Science for peer-reviewed studies published until October 2025. Inclusion criteria targeted observational studies involving participants aged ≤ 25 years from Arab League countries, focusing on the relationship between social media use and mental health indicators. Data were extracted and quality assessed using the Newcastle-Ottawa Scale adaptation for cross-sectional designs. Results Twenty-one cross-sectional studies, encompassing over 15,000 participants with a mean age ranging from 13 to 25 years and representing multiple Arab countries, met the inclusion criteria. Findings revealed consistent associations between high or problematic social media use and adverse mental health outcomes, including anxiety, depression, sleep disturbances, and academic decline. Several studies highlighted emotional investment and nighttime use as key mediators. Sleep disruption and academic interference were common outcomes across settings. Conclusion High levels of emotionally charged social media use among Arab children, adolescents, and young adults are associated with significant psychological and functional challenges, emphasizing the need for culturally tailored digital literacy and early screening. However, the predominance of cross-sectional designs across the included studies limits causal inference and underscores the necessity for future longitudinal and experimental research.",2026,2026,Asian Journal of Psychiatry,115,,104793,,https://doi.org/10.1016/j.ajp.2025.104793,,#158,Alansari 2026,"Hugo Whittome (2026-04-09 23:33:57)(Select): NOTE: Above age range but including for ""related work""; ",HUGO; Related Work ONLY; review
Emotions following social media use and their relations to mental health in young people: An ecological momentary assessment study,"Murray, Aja; Zhu, Xinxin; Xiao, Zhouni; Shanahan, Lilly; Eisner, Manuel; Sonuga-Barke, Edmund; Ribeaud, Denis","Recent theory predicts that young people's emotional reactions are important in the impact of social media use on their mental health. Here we explore this using ecological momentary assessment (EMA) data measuring social media use and emotion within the 2-week ‘Decades-to-minutes’ (D2M) study (n = 255). Dynamic structural equation modelling (DSEM) was used to examine the within-person relations between social media use and negative emotion (and vice versa), as well as the relations between negative emotions following social media use (defined as the within-person cross-lagged effect of social media use on negative affect) and depression. Results suggested a significant concurrent relation between social media use and negative emotion but no significant association between social media use and later negative emotion, or vice versa. They also suggested no significant relation between negative emotion following social media use and depression but a significant relation between social media inertia (stability of social media use from timepoint to timepoint) and depression. Our study illustrates the feasibility of capturing emotional dynamics in relation to social media use ‘in ecological context’ and their relations to mental health risk. It suggests that patterns of social media use (e.g., sustained versus intermittent use over and above levels of engagement) merit further research attention in terms of their association with mental health. Recommendations for future research include using shorter inter-prompt intervals to capture more immediate emotional reactions to social media use, and the development of more comprehensive EMA measures of social media use.",2026,2026,Journal of Affective Disorders,397,,121015,,https://doi.org/10.1016/j.jad.2025.121015,,#159,Murray 2026,"Grace Gilman (2026-04-02 21:11:53)(Select): Used surveys but with EMA method, which improves credibility but can still include biases. Found that after controlling variables that social media use and amount of social media use do not correlate with negative emotions or depression. However, did find a link between inability to log off social media and depression (what they called social media inertia). ; ",GRACE; RQ1; RQ2
Exploring the relations of subjective and objective Instagram use on young adults' mental health,"Zhao, Yifan; Cingel, Drew P.; Xie, Lindai; Yu, Muheng","We collected objective digital trace Instagram use data and subjective self-report use data to investigate relations with self-reported self-esteem, loneliness, body satisfaction, and depression among 192 young adults (ages 18–25). To our knowledge, this work is among the first of its kind to include both self-report data and digital trace data to understand similarities and differences in how each relates to aspects of users’ mental health. We measured and coded for both active and passive social media use. For objective passive Instagram use, results showed a negative relationship with loneliness and depression, and a positive relationship with body satisfaction and self-esteem. Subjective passive use, however, was related positively to depression. Subjective active use was also positively related to depression. We discuss the implications of these findings, given the observed differences in the relationships as a function of the type of Instagram use measurement.",2023,2023,Telematics and Informatics,77,,101921,,https://doi.org/10.1016/j.tele.2022.101921,,#160,Zhao 2023,"Grace Gilman (2026-04-06 03:19:40)(Select): Looks at subjective vs. objective and passive vs. active use of Instagram. Only correlations with objective use were: negative relations for loneliness and depression and positive relation to body satisfaction and self-esteem for passive use. There was no relation for active use. Subjective use of instagram related positively with depression. Authors suggested  this could be a priming bias. Data was collected during Covid(could have had more instagram use and depression), defined activities between subjective and passive use did not match, mostly female, small sample size, did not note validity of scales used.; ",GRACE; RQ1; RQ2
"Children, carers, and community members as cocreators of digital well-being","Cook, Laurel Aynne","Purpose This study examines children’s digital well-being through a stakeholder-driven, transdisciplinary research initiative. Understanding the multidimensional risks affecting a child’s digital well-being requires examining how stakeholders perceive and define the problem. The purpose of this research is to provide a deeper analysis of how the focal problem, identifying factors that influence a child’s digital well-being, should be framed. The author synthesizes insights from local agencies, teens, and medical practitioners to identify gaps in current framings and inform more comprehensive intervention strategies. In addition, this research offers insight beyond the context of digital well-being for scholars seeking to achieve societal impact through the process of stakeholder collaboration. Design/methodology/approach This research uses a stakeholder-driven approach to examine children’s digital well-being risks. Local agencies, teens, and medical professionals were engaged as active collaborators, ensuring a multi-stakeholder analysis. This research identifies and analyzes the most serious risks for children online, develops stakeholder-driven, collaboratively designed solutions, and promotes measurable improvements in children’s digital well-being through advocacy, education, and policy recommendations. This integrative approach bridges theoretical insights and practical interventions, fostering actionable solutions for policymakers, practitioners and educators seeking to enhance children’s digital well-being. Findings Local agencies contributed valuable data on child well-being, helping to identify community-specific digital health challenges. They integrated findings into workshops and parental resources. Over time, this project expanded to include teens and medical practitioners, with each contributing unique perspectives and expertise. Teens shaped the research agenda by sharing firsthand experiences of sharenting, dark design, and other online risks. They shaped research questions and contributed to peer-led digital literacy initiatives. Medical practitioners provided insights into the psychological and developmental effects of screen use and misuse. They applied research insights to refine their guidance on social media’s impact on adolescent mental health. Research limitations/implications Findings are derived from multimethod insights within specific geographic and institutional contexts, which may limit generalizability. In addition, while this research highlights a variety of risks to children’s well-being, evolving digital ecosystems and technologies require ongoing examination. For wider applicability, future work can incorporate alternative methodologies such as longitudinal analyses, as well as a broader range of diverse stakeholder perspectives, including industry leaders and policymakers. Practical implications Each partnership plays a critical role in co-developing solutions that facilitate digital well-being for children. Aligned with Transformative Consumer Research’s societal impact framework, this research integrates diverse stakeholder perspectives from project inception to implementation. This approach ensures that solutions are evidence-informed, actionable, and reflective of community needs. Social implications This research highlights a timely need for child-centered interventions that safeguard children's digital well-being. Findings help to inform teens, parents, educators, service and healthcare providers, and policymakers on addressing risks while promoting responsible digital engagement. Transdisciplinary collaboration can promote safer, developmentally appropriate environments for the internet’s youngest users. Ultimately, this work contributes to systemic change by advocating for evidence-based solutions that promote digital resilience among children, ensuring they can navigate online spaces safely while preserving their autonomy and well-being. Originality/value This impact-focused research advances scholar–stakeholder collaboration by integrating insights from local agencies, teens, and medical practitioners to address children’s digital well-being. While extant research primarily examines individual-level risks, this study adopts a transdisciplinary approach to analyze outcomes at the user, household, and community levels. By bridging scholarly research with real-world application, this study contributes impact-oriented solutions that inform both consumer protection efforts and child-centered digital design reforms.",2025,2025,European Journal of Marketing,59,6,1567-1583,,https://doi.org/10.1108/EJM-04-2024-0345,,#162,Cook 2025,Hugo Whittome (2026-04-07 23:34:10)(Select): This could be excluded if we narrow our scope a bit; ,HUGO; Maybe; RQ3
The effects of self-disclaimer Instagram captions on young women's mood and body image: The moderating effect of participants’ own photo manipulation practices,"McComb, Sarah E.; Gobin, Keisha C.; Mills, Jennifer S.","The current experiment investigated the impact of attaching self-disclaimer captions (i.e., captions about whether photos had been edited) to thin-ideal Instagram photos on young women’s body image and mood. Participants were 311 undergraduate students aged 18–25 years. Participants were randomly assigned to view images of a thin woman on Instagram with no captions, or with a generic, specific, or warning self-disclaimer caption, and completed pre and post measures of body image and mood and a questionnaire about their own photo-editing practices. Across all conditions, exposure to the images resulted in decreased body satisfaction, likelihood to compare one’s body to another’s, happiness, confidence, and anxiety. There was no significant effect of disclaimer type on body image or mood, and therefore no type of self-disclaimer had an ameliorating effect. However, specific disclaimers were superior to the other disclaimers at reducing likelihood to compare one’s body to another’s, for women high on photo manipulation. Future research should be conducted in adolescent girls and men.",2021,2021,Body Image,38,,251-261,,https://doi.org/10.1016/j.bodyim.2021.04.011,,#208,McComb 2021,Grace Gilman (2026-04-01 03:10:49)(Select): Finds that self-disclaimer captions are ineffective at reducing comparison/negative reactions. study design seemed poor in places and overall i did not like this paper.; ,GRACE; RQ3
Is social media use associated with children's well-being? Results from the UK Household Longitudinal Study,"Twigg, Liz; Duncan, Craig; Weich, Scott","Introduction There are concerns about young people's increasing use of social media and the effects this has on overall life satisfaction. Establishing the significance of social media use requires researchers to take simultaneous account of other factors that might be influential and it is essential to adopt a longitudinal perspective to investigate temporal patterns. Method Measures of happiness for children aged 10–15 from 7 waves of the UK Household Longitudinal Study were examined (n = 7596). Multilevel models were used to assess the relative association between these measures, children's social media use and individual, household and community characteristics. Results High use of social media was found to be significantly associated with change in happiness scores but was not associated with worsening life satisfaction trajectories. The most consistent factor was gender, with girls experiencing the largest decline in happiness between two time points (0.18 points) and being more likely to have a worsening trajectory over time (OR 1.77, 95% CI 1.36–2.32). Parental mental health, household support and household income were also important. Conclusion Moderate use of social media does not play an important role in shaping children's life satisfaction. Higher levels of use is associated with lower levels of happiness, especially for girls but more research is needed to understand how this technology is being used. As well as focusing on high levels of social media use, policy makers should also concentrate on particular demographic groupings and factors affecting the social fabric of the households in which children grow up.",2020,2020,Journal of Adolescence,80,,73-83,,https://doi.org/10.1016/j.adolescence.2020.02.002,,#211,Twigg 2020,"Hayden Fernandes (2026-04-04 07:12:00)(Select): Finds moderate use has little to no significant impact on well-being. High levels of use are associated with lower happiness, particularly among girls. Other factors have a stronger influence on wellbeing than social media alone, eg family environment, socioeconomic status. Age range is children aged 10-15. UK household longitudinal study, tracking changes over time. Focuses on time spent, not how SM is used. Data is self-reported.

RQ1 - How do under 25s interact with social media?: Interaction mainly measured as time spent. Does not explore types of interactions.

RQ2 - How does social media affect under 25s?: Moderate use has minimal impact on well-being, high use has lower happiness, especially for girls. Social media is not inherently harmful, but intense use has negative effects.

RQ3 - How can social media be changed to have the largest positive benefit to under 25s?: To combat intense usage, could introduce screen time awareness and usage moderation features.; ",HAYDEN; RQ2
"Young users' social media addiction: causes, consequences and preventions","Al-Samarraie, Hosam; Bello, Kirfi-Aliyu; Alzahrani, Ahmed Ibrahim; Smith, Andrew Paul; Emele, Chikezie","Purpose Social media addiction has been an ongoing topic of debate for platform developers, well-being and mental health experts. There is a limited understanding of the factors leading to the addiction of young social media users, the consequences of experiencing addiction, and the measures/mechanisms used by parents and platform providers to limit/prevent problematic social media use amongst young users. This systematic review aims to provide a comprehensive overview of the literature concerning these issues. Design/methodology/approach The Preferred Reporting Items for Systematic Reviews (PRISMA) protocol was used to evaluate and present the results. A total of 45 studies were screened and independently reviewed against predetermined criteria for eligibility. Findings The results revealed four categories of young users' addiction to social media networks (social, technological, behavioural and mental). Several prevention approaches directed at parents and platform providers were discussed. Originality/value This study offers important insights for health policy makers, platform providers, parents and researchers on designing interventions addressing social media addiction amongst young users. It also provides an in-depth understanding of the conceptualization of social media addiction and suggestions on possible actions to prevent it.",2021,2021,Information Technology & People,35,7,2314-2343,,https://doi.org/10.1108/ITP-11-2020-0753,,#213,Al-Samarraie 2021,"",HUGO; Long; review
