Title,Authors,Abstract,Published Year,Published Month,Journal,Volume,Issue,Pages,Accession Number,DOI,Ref,Covidence #,Study,Notes,Tags
Fragile Minds: Exploring the Link Between Social Media and Young Adult Mental Health,"Mcculloh, Ian; Cohen, Ben","The well documented mental health crisis among preteens and teenagers worldwide is often believed to be intertwined with the increasing ubiquity of social media services, a belief borne out by numerous findings in the literature. However, the literature has not kept pace with recent developments in the social-media sphere, such as the rise of TikTok and the decision by Instagram to pivot to video. This paper aims to help alleviate this deficiency, examining whether a correlation exists between college students' social media usage and mental health concerns. Using a random sample of 254 undergraduate college students at a mid-Atlantic university, we find (as evidenced by Spearman's rank correlation coefficients) that while there is a correlation between ""fear of missing out (FoMO)"" and social media use, the correlation is not strong, suggesting that social media use alone cannot explain observed mental health outcomes. We support previous literature regarding correlations between personality and social media use and extend it with additional measures of use to include FoMO and loneliness. We find that loneliness is weekly and inversely correlated with Instagram and Snapchat use and personality traits moderate use. We speculate that the shift in social media from peer-to-peer text to short video may be driving divergence from previous findings in the literature, lessening risk, but suggesting that additional research is needed to confirm our conclusions.",2024,2024,Proceedings of the 2023 IEEE/ACM International Conference on Advances in Social Networks Analysis and Mining,,,475–479,,10.1145/3625007.3627490,,#1,Mcculloh 2024,Grace Gilman (2026-04-01 22:54:42)(Select): online unvalidated surveys on small sample show moderate correlations between mental health problems and social media use. Do look at how personality traits moderate this.; ,GRACE; RQ2
"Teen Talk: The Good, the Bad, and the Neutral of Adolescent Social Media Use","Alluhidan, Abdulmalik; Akter, Mamtaj; Alsoubai, Ashwaq; Park, Jinkyung Katie; Wisniewski, Pamela","The debate on whether social media has a net positive or negative effect on youth is ongoing. Therefore, we conducted a thematic analysis on 2,061 posts made by 1,038 adolescents aged 15-17 on an online peer-support platform to investigate the ways in which these teens discussed popular social media platforms in their posts and to identify differences in their experiences across platforms. Our findings revealed four main emergent themes for the ways in which social media was discussed: 1) Sharing negative experiences or outcomes of social media use (58%, n = 1,095), 2) Attempts to connect with others (45%, n = 922), 3) Highlighting the positive side of social media use (20%, n = 409), and 4) Seeking information (20%, n = 491). Overall, while sharing about negative experiences was more prominent, teens also discussed balanced perspectives of connection-seeking, positive experiences, and information support on social media that should not be discounted. Moreover, we found statistical significance for how these experiences differed across social media platforms. For instance, teens were most likely to seek romantic relationships on Snapchat and self-promote on YouTube. Meanwhile, Instagram was mentioned most frequently for body shaming, and Facebook was the most commonly discussed platform for privacy violations (mostly from parents). The key takeaway from our study is that the benefits and drawbacks of teens' social media usage can co-exist and net effects (positive or negative) can vary across different teens across various contexts. As such, we advocate for mitigating the negative experiences and outcomes of social media use as voiced by teens, to improve, rather than limit or restrict, their overall social media experience. We do this by taking an affordance perspective that aims to promote the digital well-being and online safety of youth ""by design.""",2024,2024-11,Proc. ACM Hum.-Comput. Interact.,8,CSCW2,,,10.1145/3686961,,#3,Alluhidan 2024,Hugo Whittome (2026-04-12 07:46:28)(Select): Should be included because it'll be really useful for RQ1; Hugo Whittome (2026-03-26 22:41:40)(Select): THIS IS REALLY LONG :(; ,HUGO; Long; RQ1
The Language of LGBTQ+ Minority Stress Experiences on Social Media,"Saha, Koustuv; Kim, Sang Chan; Reddy, Manikanta D.; Carter, Albert J.; Sharma, Eva; Haimson, Oliver L.; De Choudhury, Munmun","LGBTQ+ (lesbian, gay, bisexual, transgender, queer) individuals are at significantly higher risk for mental health challenges than the general population. Social media and online communities provide avenues for LGBTQ+ individuals to have safe, candid, semi-anonymous discussions about their struggles and experiences. We study minority stress through the language of disclosures and self-experiences on the r/lgbt Reddit community. Drawing on Meyer's minority stress theory, and adopting a combined qualitative and computational approach, we make three primary contributions, 1) a theoretically grounded codebook to identify minority stressors across three types of minority stress-prejudice events, perceived stigma, and internalized LGBTphobia, 2) a machine learning classifier to scalably identify social media posts describing minority stress experiences, that achieves an AUC of 0.80, and 3) a lexicon of linguistic markers, along with their contextualization in the minority stress theory. Our results bear implications to influence public health policy and contribute to improving knowledge relating to the mental health disparities of LGBTQ+ populations. We also discuss the potential of our approach to enable designing online tools sensitive to the needs of LGBTQ+ individuals.",2019,2019-11,Proc. ACM Hum.-Comput. Interact.,3,CSCW,,,10.1145/3361108,,#15,Saha 2019,"Hayden Fernandes (2026-04-02 04:57:34)(Select): Uses Minority Stress Theory with Machine Learning to identify linguistic patterns associated with stress experiences.

Shows social media posts contain detectable signs of psychological stress, computational models can classify these experiences.

Data comes from Reddit users (r/lgbt). No guaranteed/controlled age range. Data collected before 2019 (publish date).

Platform bias: Reddit users.
Self-selection bias: Only people willing to post are represented.

RQ1: How do under 25s interact with social media?
Share personal experiences. Emotional disclosure. Seek community support and validation.

RQ2: How does social media affect under 25s?
May help with coping and support. Reveals psychological strain.

RQ3: How can social media be changed to have the largest positive benefit to under 25s?
Detect and respond to mental health signals. Detectable through Machine Learning.; ",HAYDEN; RQ1; RQ3
Supporting Teens’ Intentional Social Media Use Through Interaction Design: An exploratory proof-of-concept study,"Davis, Katie; Slovak, Petr; Landesman, Rotem; Pitt, Caroline; Ghajar, Abdullatif; Schleider, Jessica Lee; Kawas, Saba; Perez Portillo, Andrea Guadalupe; Kuhn, Nicole S.","Prior research indicates that many adolescents struggle to use social media intentionally, with negative impacts on well-being. This presents an important but under-researched opportunity to improve youth well-being through interaction design. We developed Locus, a mobile application that shapes adolescents’ entry experiences into the social media apps on their phones by prompting them to reflect on their social media intentions before they open an app and at the end of the day. In designing Locus, we combined psychology theories—to identify design targets—with co-design approaches—to design around these targets for youth's lived experiences. Following co-design work with nine teens (Mage=15.7 years), we conducted an open trial field deployment (N = 54; Mage=16.2 years) to explore how Locus was used and experienced by adolescents during their daily lives. Results provide preliminary evidence that in-the-moment interventions for self-regulation skills can support adolescents’ intentional social media use.",2023,2023,Proceedings of the 22nd Annual ACM Interaction Design and Children Conference,,,322–334,,10.1145/3585088.3589387,,#19,Davis 2023,"Sam Ndenecho (2026-04-02 00:22:54)(Select): However, their solution is just a launcher/wrapper app, so information is still quite limited. Nothing about what specifically in their browsing sessions made them feel a certain way, or potential quantitative data (time spent, # of posts looked at).; Sam Ndenecho (2026-04-02 00:19:29)(Select): RQ3:
Pretty good paper exploring a possible intervention for teens who potentially overuse social media.

Goes through their approach to intervention, and its positive effects on the teens' sense of agency/control, and self-reflection.; ",RQ3; SAM
Exploratory study of young children's social media needs and requirements,"Sun, Di ""Chelsea""; Melkote, Vaishnavi; Arif, Ahmed Sabbir","As social media are becoming increasingly popular among young children, it is important to explore this population's needs and requirements from these platforms. As a first step to this, we conducted an exploratory design workshop with children aged between ten and eleven years to find out about their social media needs and requirements. Through an analysis of the paper prototypes solicited from the workshop, here we discuss the social media features that are the most desired by this population.",2020,2020,Proceedings of the 2020 ACM Interaction Design and Children Conference: Extended Abstracts,,,332–337,,10.1145/3397617.3397836,,#24,Sun 2020,"Hayden Fernandes (2026-04-03 07:22:47)(Select): Children (3-13) use social media to play and explore. Influenced by parents and device accessibility. Risks of exposure to inappropriate content. Opportunity to be creative and communicate. Ages 3-13 approx, early-stage behaviour.

Doesn't track long-term effects. Likely influenced by parental control and environment.

RQ1 - How do under 25s interact with social media?: Entertainment (videos, games). Engagement is exploratory and playful, not socially complex. Use of social media begins early and develops overtime. Provides a foundation for later behaviours seen in older users.

RQ2 - How does social media affect under 25s?: Potential risks of exposure to inappropriate content, lack of understanding of online environments. Potential benefits of creativity and communication. Positive and negative developmental influences.

RQ3 - How can social media be changed to have the largest positive benefit to under 25s?
Platforms should be age-appropriate. Include parental controls. Reduce exposure to harmful content. (Safety precautions). Designs should consider developmental differences across age groups.; ",HAYDEN; RQ3
Consensus Analysis of Shared Beliefs Among Young Adults About Anonymity in Social Media,"Allen, Warren; Philips, Abigail","The social media ecosystem is constituted by platforms and applications with varying affordances for and rules regarding anonymity. How and why users use and how they percieve online anonymity remains a focus of social media and Internet research, including how beliefs about anonymity shape —and are shaped by— the behaviors of others on and beyond social media platforms. Our study contributes to knowledge about anonymity in online social platforms by exploring the shared beliefs of a sample of young adults about the recently-defunct platform Yik Yak. Findings from our mixed-methods study of students at a large university in the Southeastern United States suggest that young adults have shared beliefs about social media and anonymity, but the degree to which those beliefs are shared is tenuous. The specific of those beliefs are discussed in context of prior research about social media, anonymity and cyberbullying.",2018,2018,Proceedings of the 9th International Conference on Social Media and Society,,,13–21,,10.1145/3217804.3217893,,#25,Allen 2018,"Hugo Whittome (2026-04-04 02:43:04)(Select): * No explicit age range, but implied below 25 due to all students from college
* Reasonable study size
* Teenagers want less annonymity online, and want social media to require your age

* All responses are taken from teenages and so should be used with a grain of salt
* Some acknowlege that this could have negative impacts to some people like abuse victims
* Also talked about how annonymity brings out the worst of people, but they are still vulgar whether they are anonymous or not, but they are more vulgar
; ",HUGO; RQ2; RQ3
"""You Go Through So Many Emotions Scrolling Through Instagram"": How Teens Use Instagram To Regulate Their Emotions","Davis, Katie; Landesman, Rotem; Yoon, Jina; Kim, JaeWon; Munoz Lopez, Daniela E; Magis-Weinberg, Lucia; Hiniker, Alexis","Prior work has documented various ways that teens use social media to regulate their emotions. However, little is known about what these processes look like on a moment-by-moment basis. We conducted a diary study to investigate how teens (N=57, Mage= 16.3 years) used Instagram to regulate their emotions. We identified three kinds of emotionally-salient drivers that brought teens to Instagram and two types of behaviors that impacted their emotional experiences on the platform. Teens described going to Instagram to escape, to engage, and to manage the demands of the platform. Once on Instagram, their primary behaviors consisted of mindless diversions and deliberate acts. Although teens reported many positive emotional responses, the variety, unpredictability, and habitual nature of their experiences revealed Instagram to be an unreliable tool for emotion regulation (ER). We present a model of teens’ ER processes on Instagram and offer design considerations for supporting adolescent emotion regulation.",2025,2025,Proceedings of the 2025 CHI Conference on Human Factors in Computing Systems,,,,,10.1145/3706598.3713844,,#36,Davis 2025,"Sam Ndenecho (2026-04-01 23:06:36)(Select): A very, very, good, recent, and relevant paper for adolescents 13-17, focusing on Instagram (but including Reels too).

Highlighted and annotated with some comments. ; ",RQ1; RQ2; SAM
Techno-legal Solutionism: Regulating Children's Online Safety in the United States,"Angel, María P.; Boyd, Danah","Convinced that social media is directly harming children, policymakers have started to introduce legislation that requires technology companies to be safe by design through ""duty of care"" provisions. Unlike regulations that focus on product safety, these bills incorporate technosolutionist logics into regulation by presuming that technology companies can remedy complex harms like mental health duress and bullying if their products were only designed better. In this paper, we unpack the theory of change at the center of the ""duty of care"" included in the ""Kids Online Safety Act"" (KOSA). We argue that techno-legal solutionism is both ineffective as a framework and, in the case of KOSA, potentially harmful to the young people it purports to help.",2024,2024,Proceedings of the 2024 Symposium on Computer Science and Law,,,86–97,,10.1145/3614407.3643705,,#46,Angel 2024,"Hugo Whittome (2026-04-04 19:47:53)(Select): * US courts state that companies should mitigate risks to their customers.
* People argue against depriving young people until their brains have developed. Because it prevents their maturation
* Proposed KIDS Act bans any attempt to nudge under 16s to actively use the social media
* Blames the applications which ""reflects a techono-solutionist blief"".
  * History has shown that these are unlikely to achieve their purported goals
* Argues that it isn't just social media and the effects are complicated
* Studies have shown substance use or poor bond with carefigvers is associated with online victimization
* It also argues that social media makes mential health problems visible

Can also confirm that I don't think its funded by social media giants but could be wrong; ",A+; HUGO; RQ3
Manifestation of Depression and Loneliness on Social Networks: A Case Study of Young Adults on Facebook,"Park, Sungkyu; Kim, Inyeop; Lee, Sang Won; Yoo, Jaehyun; Jeong, Bumseok; Cha, Meeyoung","As people around the world are spending increasing amounts of time online, the question of how online experiences are linked to health and well-being is essential. This paper presents how activities on Facebook are associated with the depressive states of users. Based on online logs of 212 young adults, we show not only the sheer size of the network but also the frequency and diversity of interactions on social networks have close associations with depression. Depressed individuals reported smaller involved networks regarding comments and likes, the two popular forms of interactions. In contrast to the decreased level of interactions, depressed individuals showed an increase in the wall post rates and were active online during midday, which can be interpreted as an endemic behavior linked to the perceived degree of loneliness among young adults who are avid users of social media. We discuss these findings from theoretical, empirical, and subjective perspectives.",2015,2015,Proceedings of the 18th ACM Conference on Computer Supported Cooperative Work &amp; Social Computing,,,557–570,,10.1145/2675133.2675139,,#49,Park 2015,"Hayden Fernandes (2026-04-02 06:13:28)(Select): Finds that depressed or lonely individuals show distinct online behaviours, including more negative language and reduced social interaction. Age range is ""young adults"", implied 18-25.

Analysed status updates, interactions (likes, comments) and networking (friend interactions).Data collected prior to 2015 publication.

Platform-bias: Only Facebook.
Correleation, not causation. (Doesn't prove social media causes depression).

RQ1: How do under 25s interact with social media?
Facebook users use status updates for self-expression, and socially interact with likes/comments. Interaction patterns vary by mental state; less engagement -> higher lonliness, more negative posting -> depressive tendencies.
Interaction is both social and expressive.

2. How does social media affect under 25s?
Correlation, not causation.
Can reflect mental health states. May reinforce feelings, eg isolation through low interaction.

RQ3: How can social media be changed to have the largest positive benefit to under 25s?
Platforms could change from passive feeds to more supportive social systems.; ",HAYDEN; RQ1
Designing Cyberbullying Mitigation and Prevention Solutions through Participatory Design With Teenagers,"Ashktorab, Zahra; Vitak, Jessica","While social media platforms enable individuals to easily communicate and share experiences, they have also emerged as a tool for cyberbullying. Teenagers represent an especially vulnerable population for negative emotional responses to cyberbullying. At the same time, attempts to mitigate or prevent cyberbullying from occurring in these networked spaces have largely failed because of the complexity and nuance with which young people bully others online. To address challenges related to designing for cyberbullying intervention and mitigation, we detail findings from participatory design work with two groups of high school students in spring 2015. Over the course of five design sessions spanning five weeks, participants shared their experiences with cyberbullying and iteratively designed potential solutions. We provide an in-depth discussion of the range of cyberbullying mitigation solutions participants designed. We focus on challenges participants' identified in designing for cyberbullying support and prevention and present a set of five potential cyberbullying mitigation solutions based on the results of the design sessions.",2016,2016,Proceedings of the 2016 CHI Conference on Human Factors in Computing Systems,,,3895–3905,,10.1145/2858036.2858548,,#63,Ashktorab 2016,"Hugo Whittome (2026-04-08 23:04:25)(Select): Works with teens to design apps to create a more inclusive environment. One example is having a prompt when someone tries to crop someone else out the photo multiple times, or allowing people to have buzzwords so if they get mentioned they can explicitly allow or deny them if their account is referenced (... I think) or tries to block vulgar phrases (though in real life this is shown not to work - not mentioned in paper); ",HUGO; Long; RQ3
Associations between social media use and positive mental health among adolescents: Findings from the Canadian Health Behaviour in School-aged Children Study,"Clayborne, Zahra M.; Wong, Suzy L.; Roberts, Karen C.; Prince, Stephanie A.; Gariépy, Geneviève; Goldfield, Gary S.; Janssen, Ian; Lang, Justin J.","Social media use (SMU) has rapidly increased among children and adolescents in the past decade, and has been linked with poorer mental health. However, moderate SMU can facilitate connectedness among peers, which may have positive impacts for well-being – these associations are underexplored. This study examined the associations between SMU and several indicators of PMH in a nationally representative sample of 13,113 adolescents in grades 6 to 10 from the 2017/2018 cycle of the Canadian Health Behavior in School-aged Children (HBSC) study. SMU was measured using a four-level composite of intensity (non-active, active, intense) and problematic SMU (addictive-like symptoms, regardless of intensity). Four dichotomous indicators of PMH were examined: self-efficacy, self-confidence, life satisfaction, and psychological well-being. Covariates included grade, gender, cultural/racial background, and socioeconomic status. Unadjusted and adjusted mixed effects logistic regression models accounting for school-level clustering were run, with separate models for each PMH indicator and active SMU set as the referent. When compared to active SMU, problematic SMU was associated with lower levels of all PMH indicators, and intense SMU was associated with lower life satisfaction. In gender-stratified models, intense SMU was associated with lower life satisfaction among girls. In grade-stratified models, non-active SMU was associated with lower self-confidence for adolescents in grades 9 and 10. In all, problematic SMU is generally associated with lower odds of reporting high PMH. Longitudinal research is required to ascertain directionality of these findings, and to examine how these associations may have changed as a result of the COVID-19 pandemic.",2025,2025,Journal of Psychiatric Research,181,,333-339,,https://doi.org/10.1016/j.jpsychires.2024.11.071,,#145,Clayborne 2025,"Sam Ndenecho (2026-03-20 02:52:22)(Select): (N=13,000 young and pre-adolescents aged 11-16)
Uses the Social Media Disorder Scale.

References an interesting paper regarding active vs. passive use of social media:
https://journals.sagepub.com/doi/full/10.1089/cyber.2019.0079; Sam Ndenecho (2026-03-20 02:28:43)(Select): RQ1/RQ2
Good paper, good data, novel methodology to distinguish between intense/problematic social media use.

They point out there is a difference between ""intense social media use"" and ""problematic social media use"", and that it ISMU can be beneficial as it helps individuals connect with peers.; ",RQ1; RQ2; SAM
